{
  "budget": {
    "max_tokens": 6000000,
    "max_usd": 45.0,
    "max_wallclock_s": 21600
  },
  "bundle_ref": {
    "doc_count": 5,
    "manifest_uri": "evals/golden/CASE-700146/bundle.json",
    "page_count": 29
  },
  "case_id": "CASE-700146",
  "case_type": "INDIVIDUAL",
  "cdd_level_requested": "CDD",
  "claimed_customer": {
    "date_of_birth": "1972-08-02",
    "legal_name": "Hale Sampleton 700146",
    "nationality": "CA"
  },
  "contains_special_category_data": false,
  "created_at": "2026-10-20T12:00:00Z",
  "jurisdiction_profile": "US_FED_FINCEN_CDD",
  "policy_version": "risk-model-2026.3",
  "relationship": {
    "channels": [
      "DIGITAL"
    ],
    "expected_currency": "USD",
    "expected_monthly_volume": {
      "amount": "82000",
      "currency": "USD"
    },
    "jurisdictions": [
      "GB"
    ],
    "products": [
      "TRANSACTION_ACCOUNT",
      "FX"
    ],
    "purpose_statement": "Synthetic test of customer due diligence"
  },
  "requested_by": {
    "analyst_id": "SYNTHETIC-EVAL",
    "desk": "EVALUATION"
  },
  "schema_version": "1.0.0",
  "sla": {
    "deadline": "2026-10-30T17:00:00Z"
  },
  "trigger": "TRIGGER_EVENT"
}
