{
  "budget": {
    "max_tokens": 6000000,
    "max_usd": 45.0,
    "max_wallclock_s": 21600
  },
  "bundle_ref": {
    "doc_count": 18,
    "manifest_uri": "evals/golden/CASE-700089/bundle.json",
    "page_count": 174
  },
  "case_id": "CASE-700089",
  "case_type": "LEGAL_ENTITY",
  "cdd_level_requested": "CDD",
  "claimed_customer": {
    "incorporation_number": "TST-700089",
    "jurisdiction_of_incorporation": "SY",
    "legal_name": "Jori Trialford Trading 700089 Ltd"
  },
  "contains_special_category_data": false,
  "created_at": "2026-10-20T12:00:00Z",
  "jurisdiction_profile": "US_FED_FINCEN_CDD",
  "policy_version": "risk-model-2026.3",
  "relationship": {
    "channels": [
      "DIGITAL",
      "INTRODUCER"
    ],
    "expected_currency": "USD",
    "expected_monthly_volume": {
      "amount": "148000",
      "currency": "USD"
    },
    "jurisdictions": [
      "SY"
    ],
    "products": [
      "TRANSACTION_ACCOUNT",
      "TRADE_FINANCE",
      "CASH_DEPOSITS"
    ],
    "purpose_statement": "Synthetic test of customer due diligence"
  },
  "requested_by": {
    "analyst_id": "SYNTHETIC-EVAL",
    "desk": "EVALUATION"
  },
  "schema_version": "1.0.0",
  "sla": {
    "deadline": "2026-10-30T17:00:00Z"
  },
  "trigger": "NEW_RELATIONSHIP"
}
